{
  "schema": "lemonpress/manga-source-issue/v0",
  "corpusId": "lemonpress:manga-index-001",
  "issueId": "lemonpress:manga-index-001:issue-003",
  "status": "ASSEMBLED_SOURCE",
  "issueSequence": 3,
  "title": "THE AIR REMEMBERS",
  "sourceAssembly": {
    "provider": "google-drive",
    "folderId": "1a5LLp7rjrqWKWe-8jzJGmd6wl6-D7mEF",
    "url": "https://drive.google.com/drive/folders/1a5LLp7rjrqWKWe-8jzJGmd6wl6-D7mEF"
  },
  "pageCount": 12,
  "pages": [
    {
      "slot": 1,
      "pageId": "issue-003-page-001",
      "displayTitle": "Wednesday Transmission - Cover",
      "source": {
        "provider": "google-drive",
        "fileId": "1a8fU-cwHTrYPtlilI1nhcEYFfWtE7PVl",
        "fileName": "01 - Wednesday Transmission - Cover.png",
        "mimeType": "image/png",
        "url": "https://drive.google.com/file/d/1a8fU-cwHTrYPtlilI1nhcEYFfWtE7PVl/view?usp=drivesdk"
      }
    },
    {
      "slot": 2,
      "pageId": "issue-003-page-002",
      "displayTitle": "Wednesday Transmission - Field Notes",
      "source": {
        "provider": "google-drive",
        "fileId": "1Pnl4jWNb_bxyr-Z83fSbgbPSmbvGN1Qj",
        "fileName": "02 - Wednesday Transmission - Field Notes.png",
        "mimeType": "image/png",
        "url": "https://drive.google.com/file/d/1Pnl4jWNb_bxyr-Z83fSbgbPSmbvGN1Qj/view?usp=drivesdk"
      }
    },
    {
      "slot": 3,
      "pageId": "issue-003-page-003",
      "displayTitle": "Everybody Is an Instrument Until It Rests",
      "source": {
        "provider": "google-drive",
        "fileId": "1kumyn3Lj7HL1NxhKf5B9P9busYzeIPIy",
        "fileName": "03 - Everybody Is an Instrument Until It Rests.png",
        "mimeType": "image/png",
        "url": "https://drive.google.com/file/d/1kumyn3Lj7HL1NxhKf5B9P9busYzeIPIy/view?usp=drivesdk"
      }
    },
    {
      "slot": 4,
      "pageId": "issue-003-page-004",
      "displayTitle": "The Air Remembers",
      "source": {
        "provider": "google-drive",
        "fileId": "1blVwfTJM7-O6WJ7eLSLUwjAERIgMihtP",
        "fileName": "04 - The Air Remembers.png",
        "mimeType": "image/png",
        "url": "https://drive.google.com/file/d/1blVwfTJM7-O6WJ7eLSLUwjAERIgMihtP/view?usp=drivesdk"
      }
    },
    {
      "slot": 5,
      "pageId": "issue-003-page-005",
      "displayTitle": "The Static Collective - Equinox Equalizer",
      "source": {
        "provider": "google-drive",
        "fileId": "1ONol8secjNrSEtGNsYWH1i-z8TU7u5Qd",
        "fileName": "05 - The Static Collective - Equinox Equalizer.png",
        "mimeType": "image/png",
        "url": "https://drive.google.com/file/d/1ONol8secjNrSEtGNsYWH1i-z8TU7u5Qd/view?usp=drivesdk"
      }
    },
    {
      "slot": 6,
      "pageId": "issue-003-page-006",
      "displayTitle": "The Bus Joins the Band - Tik Tok",
      "source": {
        "provider": "google-drive",
        "fileId": "1dWsmzgAWyiyq2SFgP1PVOM5EDtZJ68MQ",
        "fileName": "06 - The Bus Joins the Band - Tik Tok.png",
        "mimeType": "image/png",
        "url": "https://drive.google.com/file/d/1dWsmzgAWyiyq2SFgP1PVOM5EDtZJ68MQ/view?usp=drivesdk"
      }
    },
    {
      "slot": 7,
      "pageId": "issue-003-page-007",
      "displayTitle": "The Wave Comes Through",
      "source": {
        "provider": "google-drive",
        "fileId": "1lax33xMD0uctm0Z7Xrfc0hAGNB2ca72t",
        "fileName": "07 - The Wave Comes Through.png",
        "mimeType": "image/png",
        "url": "https://drive.google.com/file/d/1lax33xMD0uctm0Z7Xrfc0hAGNB2ca72t/view?usp=drivesdk"
      }
    },
    {
      "slot": 8,
      "pageId": "issue-003-page-008",
      "displayTitle": "The House Receives the Wave",
      "source": {
        "provider": "google-drive",
        "fileId": "102LHiRhol53d228uM0VeK8U5AWJywkRX",
        "fileName": "08 - The House Receives the Wave.png",
        "mimeType": "image/png",
        "url": "https://drive.google.com/file/d/102LHiRhol53d228uM0VeK8U5AWJywkRX/view?usp=drivesdk"
      }
    },
    {
      "slot": 9,
      "pageId": "issue-003-page-009",
      "displayTitle": "The Page That Needed a Stone - Part II",
      "source": {
        "provider": "google-drive",
        "fileId": "1LXav0cv0X3xV6EdTqGLRZR0gcJhjilq4",
        "fileName": "09 - The Page That Needed a Stone - Part II.png",
        "mimeType": "image/png",
        "url": "https://drive.google.com/file/d/1LXav0cv0X3xV6EdTqGLRZR0gcJhjilq4/view?usp=drivesdk"
      }
    },
    {
      "slot": 10,
      "pageId": "issue-003-page-010",
      "displayTitle": "The Note That Refused the Staff",
      "source": {
        "provider": "google-drive",
        "fileId": "1-qrcoNa_UNF-ybgZo-YfT76ezdNBeB2Y",
        "fileName": "10 - The Note That Refused the Staff.jpg",
        "mimeType": "image/jpeg",
        "url": "https://drive.google.com/file/d/1-qrcoNa_UNF-ybgZo-YfT76ezdNBeB2Y/view?usp=drivesdk"
      }
    },
    {
      "slot": 11,
      "pageId": "issue-003-page-011",
      "displayTitle": "The Song That Arrived Before It Was Written",
      "source": {
        "provider": "google-drive",
        "fileId": "1yRa1QzRJ4RV2iaXQX9SXgLkBadoLzNbS",
        "fileName": "11 - The Song That Arrived Before It Was Written.png",
        "mimeType": "image/png",
        "url": "https://drive.google.com/file/d/1yRa1QzRJ4RV2iaXQX9SXgLkBadoLzNbS/view?usp=drivesdk"
      }
    },
    {
      "slot": 12,
      "pageId": "issue-003-page-012",
      "displayTitle": "The Chord That Remembered - Part III",
      "source": {
        "provider": "google-drive",
        "fileId": "1Mg_jh-vFfQo-RzFa4LEPPhMz5opj0o6L",
        "fileName": "12 - The Chord That Remembered - Part III.jpg",
        "mimeType": "image/jpeg",
        "url": "https://drive.google.com/file/d/1Mg_jh-vFfQo-RzFa4LEPPhMz5opj0o6L/view?usp=drivesdk"
      }
    }
  ],
  "authority": {
    "sourceMutation": false,
    "admission": false,
    "publication": false,
    "release": false
  },
  "laws": [
    "ISSUE != FILE COLLECTION",
    "DRIVE LOCATION != AUTHORITY",
    "ORDER != ANCESTRY",
    "INDEX != ADMISSION",
    "SOURCE ASSEMBLY != PUBLICATION"
  ]
}
