{
  "schema": "lemonpress/manga-source-issue/v0",
  "corpusId": "lemonpress:manga-index-001",
  "issueId": "lemonpress:manga-index-001:issue-002",
  "status": "ASSEMBLED_SOURCE",
  "issueSequence": 2,
  "title": "THE THIRTEENTH CUP",
  "sourceAssembly": {
    "provider": "google-drive",
    "folderId": "1pOXknOUcn3ZYQAt9JDYgJX0mo5VjgRVL",
    "url": "https://drive.google.com/drive/folders/1pOXknOUcn3ZYQAt9JDYgJX0mo5VjgRVL"
  },
  "pageCount": 12,
  "pages": [
    {
      "slot": 1,
      "pageId": "issue-002-page-001",
      "displayTitle": "The Sky Wants In",
      "source": {
        "provider": "google-drive",
        "fileId": "1pvOGgfC-3oXEHZmRLEENLcGg8mlYrh_r",
        "fileName": "01 - The Sky Wants In.png",
        "mimeType": "image/png",
        "url": "https://drive.google.com/file/d/1pvOGgfC-3oXEHZmRLEENLcGg8mlYrh_r/view?usp=drivesdk"
      }
    },
    {
      "slot": 2,
      "pageId": "issue-002-page-002",
      "displayTitle": "The Bus That Joined the Band",
      "source": {
        "provider": "google-drive",
        "fileId": "1-r1KRhDX7b3b-v9AdKdI7S79nVev8tz0",
        "fileName": "02 - The Bus That Joined the Band.png",
        "mimeType": "image/png",
        "url": "https://drive.google.com/file/d/1-r1KRhDX7b3b-v9AdKdI7S79nVev8tz0/view?usp=drivesdk"
      }
    },
    {
      "slot": 3,
      "pageId": "issue-002-page-003",
      "displayTitle": "The Chair That Arrived First",
      "source": {
        "provider": "google-drive",
        "fileId": "1MMTLyREAR92pZMJNKr4ahr4w6E8e8iEj",
        "fileName": "03 - The Chair That Arrived First.png",
        "mimeType": "image/png",
        "url": "https://drive.google.com/file/d/1MMTLyREAR92pZMJNKr4ahr4w6E8e8iEj/view?usp=drivesdk"
      }
    },
    {
      "slot": 4,
      "pageId": "issue-002-page-004",
      "displayTitle": "The Dog Park Soundcheck",
      "source": {
        "provider": "google-drive",
        "fileId": "19qR0PsCGczjZyRHANkM_T6J1saVIDcuP",
        "fileName": "04 - The Dog Park Soundcheck.png",
        "mimeType": "image/png",
        "url": "https://drive.google.com/file/d/19qR0PsCGczjZyRHANkM_T6J1saVIDcuP/view?usp=drivesdk"
      }
    },
    {
      "slot": 5,
      "pageId": "issue-002-page-005",
      "displayTitle": "The Thirteenth Cup - Leave It Open",
      "source": {
        "provider": "google-drive",
        "fileId": "1A3FJ4aiON21QEHOFI_-lelvwK1Ezu_bU",
        "fileName": "05 - The Thirteenth Cup - Leave It Open.png",
        "mimeType": "image/png",
        "url": "https://drive.google.com/file/d/1A3FJ4aiON21QEHOFI_-lelvwK1Ezu_bU/view?usp=drivesdk"
      }
    },
    {
      "slot": 6,
      "pageId": "issue-002-page-006",
      "displayTitle": "The Thirteenth Cup - More Chairs",
      "source": {
        "provider": "google-drive",
        "fileId": "1XlardMuU1uRSeaioz9VHbcKwqLtqZ2Ec",
        "fileName": "06 - The Thirteenth Cup - More Chairs.png",
        "mimeType": "image/png",
        "url": "https://drive.google.com/file/d/1XlardMuU1uRSeaioz9VHbcKwqLtqZ2Ec/view?usp=drivesdk"
      }
    },
    {
      "slot": 7,
      "pageId": "issue-002-page-007",
      "displayTitle": "The Thirteenth Cup - Jubilee Engine",
      "source": {
        "provider": "google-drive",
        "fileId": "1-cZS1SZLZZ_CScLCsvtaFY-HFbdd-HS4",
        "fileName": "07 - The Thirteenth Cup - Jubilee Engine.png",
        "mimeType": "image/png",
        "url": "https://drive.google.com/file/d/1-cZS1SZLZZ_CScLCsvtaFY-HFbdd-HS4/view?usp=drivesdk"
      }
    },
    {
      "slot": 8,
      "pageId": "issue-002-page-008",
      "displayTitle": "The Thirteenth Cup - There Were",
      "source": {
        "provider": "google-drive",
        "fileId": "1AY5lLzgNjpgqYeSctieHBMSQ-G-XAV9f",
        "fileName": "08 - The Thirteenth Cup - There Were.png",
        "mimeType": "image/png",
        "url": "https://drive.google.com/file/d/1AY5lLzgNjpgqYeSctieHBMSQ-G-XAV9f/view?usp=drivesdk"
      }
    },
    {
      "slot": 9,
      "pageId": "issue-002-page-009",
      "displayTitle": "The Chair That Stayed",
      "source": {
        "provider": "google-drive",
        "fileId": "16sZ6WkXNPOQRMGrlnCZbArKgptwSuUDe",
        "fileName": "09 - The Chair That Stayed.png",
        "mimeType": "image/png",
        "url": "https://drive.google.com/file/d/16sZ6WkXNPOQRMGrlnCZbArKgptwSuUDe/view?usp=drivesdk"
      }
    },
    {
      "slot": 10,
      "pageId": "issue-002-page-010",
      "displayTitle": "The Page That Needed a Stone",
      "source": {
        "provider": "google-drive",
        "fileId": "1vt6Mb78KHyz4ksFS4NjmTzYNgiCcqrzo",
        "fileName": "10 - The Page That Needed a Stone.png",
        "mimeType": "image/png",
        "url": "https://drive.google.com/file/d/1vt6Mb78KHyz4ksFS4NjmTzYNgiCcqrzo/view?usp=drivesdk"
      }
    },
    {
      "slot": 11,
      "pageId": "issue-002-page-011",
      "displayTitle": "The Floor Doesn't Sleep",
      "source": {
        "provider": "google-drive",
        "fileId": "1b5R-t3G2_8c7z8i-hW3_St29Uw5Ig-HY",
        "fileName": "11 - The Floor Doesn't Sleep.png",
        "mimeType": "image/png",
        "url": "https://drive.google.com/file/d/1b5R-t3G2_8c7z8i-hW3_St29Uw5Ig-HY/view?usp=drivesdk"
      }
    },
    {
      "slot": 12,
      "pageId": "issue-002-page-012",
      "displayTitle": "Wednesday Transmission",
      "source": {
        "provider": "google-drive",
        "fileId": "1feHfLGRrJiFGltfeT4EPb6oPEK9m3-ek",
        "fileName": "12 - Wednesday Transmission.png",
        "mimeType": "image/png",
        "url": "https://drive.google.com/file/d/1feHfLGRrJiFGltfeT4EPb6oPEK9m3-ek/view?usp=drivesdk"
      }
    }
  ],
  "authority": {
    "sourceMutation": false,
    "admission": false,
    "publication": false,
    "release": false
  },
  "laws": [
    "ISSUE != FILE COLLECTION",
    "DRIVE LOCATION != AUTHORITY",
    "ORDER != ANCESTRY",
    "INDEX != ADMISSION",
    "SOURCE ASSEMBLY != PUBLICATION"
  ]
}
